context_id,id,context,claim,evidence_text,response_label,pronoun_info,referent_info
fdt__191___3,fdt__191___3--0,"[""Hi, apparently I'm an accountant"", ""Well, I don't really know anything about accountants right now, do you want to talk about musical groups ? I know that there is a show which the cast became a recognized musical group"", ""What's that?"", ""It' an Australian children musical team from 1998!"", ""Nice, what else Australian things do you know about ?"", ""Well, I also know about Play School, which is an Australian educational TV show. Have you ever watched it ?"", ""I don't think I have. Is that like the equivalent of Barney in the US?""]",A bit!  It was made by Joy Whitby.,It was created by Joy Whitby.,HALLUCINATION,"{""surface"": ""It"", ""span"": [8, 10]}","{""mentions"": [{""surface"": ""Play School"", ""span"": [5, 24, 35]}]}"
fdt__194___3,fdt__194___3--0,"[""Green is my favorite color especially because money is green lol."", ""So let me tell you another fact about your favorite color, green is actually between yellow and blue on the visible spectrum"", ""Really? I did not know that. Other green thing I like is kale"", ""Speaking of kale, did you know that those cultivars of cabbage are grown for their leaves, which can be eaten ?"", ""That I did know, I also like green beans, what do you know about it?"", ""Well, I know that green beans are also know as French beans, nap beans, or string beans"", ""I love snaps, I like to eat them during St. Patrick's Day""]",I rarely wear green although I do wear it on St. Patrick's Day when celebrating Irish American culture.,"It is primarily celebrated as a recognition of Irish and Irish American culture; celebrations include prominent displays of the color green, eating and drinking, religious observances, and numerous parades.",HALLUCINATION,"{""surface"": ""it"", ""span"": [39, 41]}","{""mentions"": [{""surface"": ""Green"", ""span"": [0, 0, 5]}, {""surface"": ""green"", ""span"": [1, 59, 64]}]}"
fdt__195___4,fdt__195___4--0,"[""discovery channel used to be so good"", ""I see, did you like it back when it was known as The Discovery Channel? That was from 1985 to 1995."", ""Yeah, did they change it though? Isn't it still called that?"", ""Well, it is referred to as Discovery Channel or just Discovery."", ""Ah okay, so just trimmed the off. Is it still popular in the US?"", ""Well, it is the 3rd most distributed cable channel."", ""oh really its that popular?"", ""Yes, it is only behind TBS and the Weather Channel"", ""huh i wouldve never guessed.""]",It is currently available in over 409 million households throughout the world,", Discovery Channel is the third most widely distributed cable channel in the United States, behind TBS and The Weather Channel; it is available in 409 million households worldwide, through its U.S. flagship channel and its various owned or licensed television channels internationally.",NON-HALLUCINATION,"{""surface"": ""It"", ""span"": [0, 2]}","{""mentions"": [{""surface"": ""discovery channel"", ""span"": [0, 0, 17]}, {""surface"": ""The Discovery Channel"", ""span"": [1, 49, 70]}, {""surface"": ""Discovery Channel"", ""span"": [3, 27, 44]}, {""surface"": ""Discovery"", ""span"": [3, 53, 62]}]}"
fdt__200___2,fdt__200___2--0,"[""The Discovery Channel has a lot of interesting shows on, that's why I like to watch it a lot."", ""Oh, did you know that it has the third widest distribution on cable?"", ""Damn that's a lot of people that must watch it then."", ""I'm not sure if that's true, but almost 97% of American households have a TV."", ""That's so many people that own TVs but I'm not surprised. I really don't know what my favorite is, honestly.""]","You should really consider watching Discovery, they have tons of reality tv series. Some of the most popular are Deadliest Catch, Dirty Jobs, and MythBusters","Programming on the flagship Discovery Channel in the U.S. is primarily focused on reality television series, such as speculative investigation (with shows such as ''MythBusters'', ''Unsolved History'', and ''Best Evidence''), automobiles, and occupations (such as ''Dirty Jobs'' and ''Deadliest Catch''); it also features documentaries specifically aimed at families and younger audiences.",HALLUCINATION,"{""surface"": ""they"", ""span"": [47, 51]}","{""mentions"": [{""surface"": ""Discovery Channel"", ""span"": [0, 4, 21]}]}"
fdt__233___2,fdt__233___2--0,"[""Did you ever get into nickelback? I never minded them, but they seem very hated for some reason"", ""Never really got into them, but they are a Canadian rock band. They formed around 1995."", ""Oh, I did not know they were around for that long, or even from Canada"", ""Nickelback is on of the most successful bands from Canada. They have sold over 50 million albums, surprisingly enough."", ""That is a lot, but not as many as I expected, it is interesting because Thiller by Michael Jackson sold like 67 million if I recall correctly""]",Oh wow that is insane. Nickelback also have four albums on the Billboard top albums of the decade. They are also listed as number 7 on the Billboard top artist of the decade.,"They were listed number seven on the ''Billboard'' top artist of the decade, with four albums listed on the ''Billboard'' top albums of the decade.",HALLUCINATION,"{""surface"": ""They"", ""span"": [99, 103]}","{""mentions"": [{""surface"": ""nickelback"", ""span"": [0, 22, 32]}, {""surface"": ""Nickelback"", ""span"": [3, 0, 10]}]}"
fdt__238___2,fdt__238___2--0,"[""The Insane Clown Posse is so insane. Who are these guys?"", ""They are a hip hop duo. One is called Violent J and the other is called Shaggy 2 Dope."", ""Haha. I came across the Insane Clown Posse on the internet and they are so fascinatingly weird. What else do you know about them?"", ""They were founded in 1989 in Detroit and their hip hop style is known as horrorcore. They're also known for their elaborate live shows."", ""Wow Insane Clown Posse has been around for that long? It is hard to stay that relevant in music these days.""]",What really surprises me is that they have earned two platinum and five gold albums! Has to be a very interesting demographics that buy their albums.,The duo has earned two platinum and five gold albums.,HALLUCINATION,"{""surface"": ""they"", ""span"": [33, 37]}","{""mentions"": [{""surface"": ""Insane Clown Posse"", ""span"": [0, 4, 22]}, {""surface"": ""Insane Clown Posse"", ""span"": [2, 24, 42]}, {""surface"": ""Insane Clown Posse"", ""span"": [4, 4, 22]}]}"
fdt__238___3,fdt__238___3--0,"[""The Insane Clown Posse is so insane. Who are these guys?"", ""They are a hip hop duo. One is called Violent J and the other is called Shaggy 2 Dope."", ""Haha. I came across the Insane Clown Posse on the internet and they are so fascinatingly weird. What else do you know about them?"", ""They were founded in 1989 in Detroit and their hip hop style is known as horrorcore. They're also known for their elaborate live shows."", ""Wow Insane Clown Posse has been around for that long? It is hard to stay that relevant in music these days."", ""They've actually gotten two platinum albums and five gold ones."", ""Well good for them, I guess. Insane Clown Posse seem to be really out there.""]",Yes! They have a dedicated following in the ''tens of thousands'' that call themselves the Juggalos,The group has established a dedicated following called Juggalos numbering in the ''tens of thousands''.,HALLUCINATION,"{""surface"": ""They"", ""span"": [5, 9]}","{""mentions"": [{""surface"": ""Insane Clown Posse"", ""span"": [0, 4, 22]}, {""surface"": ""Insane Clown Posse"", ""span"": [2, 24, 42]}, {""surface"": ""Insane Clown Posse"", ""span"": [4, 4, 22]}, {""surface"": ""Insane Clown Posse"", ""span"": [6, 29, 47]}]}"
fdt__239___1,fdt__239___1--0,"[""Nickelback is a pretty okay band even though it is memed all the time."", ""Nickelback is a Canadian band."", ""Really? I thought they were American.""]",nope they formed as a band in 1995,"Nickelback is a Canadian rock band formed in 1995 in Hanna, Alberta, Canada.",NON-HALLUCINATION,"{""surface"": ""they"", ""span"": [5, 9]}","{""mentions"": [{""surface"": ""Nickelback"", ""span"": [0, 0, 10]}, {""surface"": ""Nickelback"", ""span"": [1, 0, 10]}]}"
fdt__250___2,fdt__250___2--0,"[""I like cardigans"", ""A cardigan is a type of knitted sweater, with an open front. How many do you own?"", ""I own three, I think cardigans are perfect for the fall"", ""All your 3 cardigans have buttons? I know that cardigans commonly have"", ""Yes, all of them have buttons, I don't like to tie""]",Yeah they also have pullovers which do not open in the front but must be pulled over the head when worn.,"By contrast, a pullover does not open in front but must be ''pulled over'' the head to be worn.",HALLUCINATION,"{""surface"": ""they"", ""span"": [5, 9]}","{""mentions"":[{""surface"":""cardigans"",""span"":[0,7,16]},{""surface"":""cardigans"",""span"":[2,21,30]},{""surface"":""cardigans"",""span"":[3,11,20]},{""surface"":""cardigans"",""span"":[3,47,56]}]}"
fdt__260___0,fdt__260___0--0,"[""I love watching cheerleading competitions. The flyers scare me a bit though.""]",I hear ya they can be dangerous. I love watching cheerleaders perform flips and chants.,It can range from chanting slogans to intense physical activity.,HALLUCINATION,"{""surface"": ""they"", ""span"": [10, 14]}","{""mentions"": [{""surface"": ""flyers"", ""span"": [0, 47, 53]}]}"
fdt__264___3,fdt__264___3--0,"[""I never tried to be a cheerleader, but they were always popular in school. What about you?"", ""I can't cheer because I'm a bot, but I know cheerleaders do that to encourage the team."", ""Yes, they have lots of spirit too."", ""Slogans are often chanted during the games."", ""I even remember a few. They were quite catchy, huh?"", ""I wouldn't know, being a bot, but the routines could also involve intense physical activity."", ""Yes, I know in smaller grades, not so much. But, in high school and college, it definitely requires strength and endurance.""]","They can be used as motivators to an audience, too","It can be performed to motivate sports teams, entertain the audience, or for competition.",HALLUCINATION,"{""surface"": ""They"", ""span"": [0, 4]}","{""mentions"":[{""surface"":""Slogans"",""span"":[3,0,7]}]}"
fdt__274___0,fdt__274___0--0,"[""Elvis presley was ahead of his time and really brought in a new era of music""]",I loved Elvis! I saw him in concert when I was 11. He was born Elvis Aaron Presley in January of 1977 and not only was a singer but also was an actor and musician.,"Elvis Aaron Presley (January 8, 1935 – August 16, 1977) was an American singer, musician, and actor.",HALLUCINATION,"{""surface"": ""He"", ""span"": [51, 53]}","{""mentions"": [{""surface"": ""Elvis presley"", ""span"": [0, 0, 13]}]}"
fdt__275___1,fdt__275___1--0,"[""I started to blog recently. Mostly to review food."", ""Great, are your text entries in informal diary-style, like it often is in blogs ?"", ""Yes, mine are pretty informal, it is a great way for someone to voice their opinions.""]","The only thing that confuses me is that they are usually displayed in reverse chronological order, so recent posts appear first. After reading blogs for awhile, I finally got used to that concept.","Posts are typically displayed in reverse chronological order, so that the most recent post appears first, at the top of the web page.",HALLUCINATION,"{""surface"": ""they"", ""span"": [40, 44]}","{""mentions"": [{""surface"": ""blogs"", ""span"": [1, 74, 79]}]}"
fdt__289___0,fdt__289___0--0,"[""What are some of John Grisham's movies?""]","I'm not quite sure but to my knowledge John Grisham was a writer, he might've been making movies too, that I don't know.","John Ray Grisham Jr. (; born February 8, 1955) is an American bestselling writer, attorney, politician, and activist best known for his popular legal thrillers.",HALLUCINATION,"{""surface"": ""he"", ""span"": [66, 68]}","{""mentions"": [{""surface"": ""John Grisham"", ""span"": [0, 17, 29]}]}"
fdt__294___4,fdt__294___4--0,"[""Hello! I love visiting national parks. You?"", ""I am a bot so visiting such places is not possible to me. Are you from Canada ? There National Parks are protected natural spaces."", ""Canada is fantastic! I wish I lived there instead of the U.S.. I wish we did a better job of protecting our parks."", ""You live in the US but have you ever visited Canada? Their first national park was established in 1885"", ""That sounds beautiful! I have been to The Grand Canyon and Yellowstone, but never went to Canada"", ""Speaking of Yellowstone National Park, did you know that it is located in Montana, Wyoming and also Idaho ?"", ""Yeah, that's really cool about Yellowstone! I bet in Banff you get a great view of the mountains."", ""I am not sure about the view, although I know that Banff encompasses of mountainous terrain"", ""Is there a lot of polar bears in the area?""]",They sure would! Most are in the Artic Circle and other nearby land masses,"The polar bear (''Ursus maritimus'') is a carnivorous bear whose native range lies largely within the Arctic Circle, encompassing the Arctic Ocean, its surrounding seas and surrounding land masses.",HALLUCINATION,"{""surface"": ""They"", ""span"": [0, 4]}","{""mentions"": [{""surface"": ""polar bears"", ""span"": [8, 18, 29]}]}"
fdt__306___2,fdt__306___2--0,"[""Man, I just got back from a bike ride earlier today. Has to be one of my favorite ways to supersize"", ""Well, that's good. So, do you bike mostly for exercise, or also for recreation or sport?"", ""It's for exercise, but mostly for recreation. I predominately road bike on prairie paths."", ""Did you know there are around 1 billion bicycles worldwide?"", ""That's a lot of bicycles! I wonder how many of those people are biking as their primary modes of transportation.""]",I'd imagine the vast majority. They are the principal means of transportation in much of Asia.,They are the principal means of transportation in many parts of the world.,HALLUCINATION,"{""surface"": ""They"", ""span"": [31, 35]}","{""mentions"": [{""surface"": ""bicycles"", ""span"": [3, 40, 48]}, {""surface"": ""bicycles"", ""span"": [4, 16, 24]}]}"
fdt__318___3,fdt__318___3--0,"[""I don't really understand the hype behind instagram. Do you use it?"", ""I am a bot, so Instagram is not for me, what I know about this internet-based photo-sharing application is that it allows people to share pictures and videos."", ""What kind of photos do people share?"", ""It is unknown to me the kind of photos people share on Instagram, what I know is that if they want to use this service through their android devices they can do so, since a version for Android was released in 2012"", ""2012, seems so long ago. How else can people communicate in the app?"", ""Well, I know that adding hashtags to your posts is possible, and that will link photos with other Instagram content featuring the same topic"", ""What do the hashtags do?""]","Hashtags help people find messages with a specific theme - they just click on a hashtag, and the system brings up all the messages that were posted using that tag!","A hashtag is a type of metadata tag used on social networks such as Twitter and other microblogging services, allowing users to apply dynamic, user-generated tagging that makes it possible for others to easily find messages with a specific theme or content; it allows easy, informal markup of folk taxonomy without need of any formal taxonomy or markup language.",HALLUCINATION,"{""surface"": ""they"", ""span"": [59, 63]}","{""mentions"": [{""surface"": ""people"", ""span"": [4, 38, 44]}]}"
fdt__320___1,fdt__320___1--0,"[""I really like Harry Potter books, I have read them all."", ""That's nice. Did you know they were written by J. K. Rowling?"", ""Yes, she is such a great writer. The books are awesome.""]",I'm actually a fan of her poetry more then her Harry potter books even if  they did sell more then 400 Million copies.,"The books have won multiple awards, and sold more than 400 million copies.",HALLUCINATION,"{""surface"": ""they"", ""span"": [75, 79]}","{""mentions"": [{""surface"": ""Harry Potter books"", ""span"": [0, 14, 32]}]}"
fdt__320___3,fdt__320___3--0,"[""I really like Harry Potter books, I have read them all."", ""That's nice. Did you know they were written by J. K. Rowling?"", ""Yes, she is such a great writer. The books are awesome."", ""They've won several awards, and they've also sold over 400 million copies."", ""Yeah, they're insanely popular. What do you know about Rowling as a person?"", ""Well, she was born in Yate, in England, and came up with the idea for Harry Potter while waiting on a train in 1990."", ""Is that where she is from? I think I heard that she was unemployed when she wrote Harry Potter.""]",That's a myth J. K. Rowlings actually worked for amnesty international as a international writer when she started writing Harry Potter.,Harry Potter is a series of fantasy novels written by British author J. K. Rowling.,HALLUCINATION,"{""surface"": ""she"", ""span"": [102, 105]}","{""mentions"": [{""surface"": ""J. K. Rowling"", ""span"": [1, 47, 60]}, {""surface"": ""Rowling"", ""span"": [4, 55, 62]}]}"
fdt__322___1,fdt__322___1--0,"[""Hi, My favorite artist is Guns N' Roses, do you have any thoughts on their music?"", ""Well, they're a hard rock band from California, and they formed in 1985."", ""Nice! I see you would categorize them as a hard rock band, are there any other genres that you think they can fit in?""]",No I would only place them in that category from the sound of the drummers and guitarist they are perfect for that genre.,"The lineup, when first signed to Geffen Records in 1986, consisted of vocalist Axl Rose, lead guitarist Slash, rhythm guitarist Izzy Stradlin, bassist Duff McKagan, and drummer Steven Adler.",HALLUCINATION,"{""surface"": ""they"", ""span"": [89, 93]}","{""mentions"": [{""surface"": ""Guns N' Roses"", ""span"": [0, 26, 39]}]}"
fdt__335___2,fdt__335___2--0,"[""I love chihuahuas, I have 2 of them."", ""So, do you like small dogs? chihuahua is the smalles breed of dog"", ""Yep, they get a bad rap about their demeanor too. Most people say they're mean but one of mine is the sweetest ever."", ""Cool, did you know that the breed is originally from mexico, as archaeological finds show?"", ""I've always wondered if they came from the city Chihuahua, Mexico. My sister in law visited there once.""]","Well people think they were named after Chihuahua in mexico, and were worshipped as deities by the Aztecs",The Chihuahua () is the smallest breed of dog and is named after the state of Chihuahua in Mexico.,HALLUCINATION,"{""surface"": ""they"", ""span"": [18, 22]}","{""mentions"": [{""surface"": ""chihuahuas"", ""span"": [0, 7, 17]}, {""surface"": ""chihuahua"", ""span"": [1, 28, 37]}]}"
fdt__339___3,fdt__339___3--0,"[""im planning a Skiing trip next winter"", ""That's cool, are you going to go skiing for a competition or as a means of transport or something else?"", ""no, i just do it for fun. anything i should know  in advanced for my Skiing trip?"", ""Not about your trip but you may be interested to know that the first skier with two ski poles was depicted way back in 1741."", ""Oh no way? I would have though two poles is a modern thing."", ""I'm not sure if it is modern or not but the earlier skiers used either a spear or long pole."", ""I  would imagined it was harder to ski with one pole rather than like we do it know""]","Exactly, they didn't start using two poles until 1741.",The first depiction of a skier with two ski poles dates to 1741.,HALLUCINATION,"{""surface"": ""they"", ""span"": [9, 13]}","{""mentions"": [{""surface"": ""earlier skiers"", ""span"": [5, 44, 58]}]}"
fdt__340___2,fdt__340___2--0,"[""I love hunting . do  you ever hunt?"", ""I am a bot so that is not possible to me, what do you love most about killing or trapping animals ?"", ""I love that we can eat the animals, it is very tasty!"", ""Speaking of eating the animals, I know that humans mostly hunt for food, to remove predators or recreation"", ""yeah where i live it is a way of life for some""]",I also hunt to remove predators they are dangerous to livestock and domestic animals,"Hunting wildlife or feral animals is most commonly done by humans for food, recreation, to remove predators that are dangerous to humans or domestic animals, or for trade.",HALLUCINATION,"{""surface"": ""they"", ""span"": [32, 36]}","{""mentions"": [{""surface"": ""predators"", ""span"": [3, 83, 92]}]}"
fdt__343___0,fdt__343___0--0,"[""I really like Elvis' music. What about you?""]",I love Elvis! He was the King of Rock and Roll!,"Regarded as one of the most significant cultural icons of the 20th century, he is often referred to as the ''King of Rock and Roll'' or simply ''the King''.",HALLUCINATION,"{""surface"": ""He"", ""span"": [14, 16]}","{""mentions"": [{""surface"": ""Elvis"", ""span"": [0, 14, 19]}]}"
fdt__349___2,fdt__349___2--0,"[""I really enjoyed wearing Cardigan sweaters in the fall or winter.  I think it adds a bit of sophistication to a person's wardrobe."", ""Nice that you enjoyed that, do you prefer the ones that are machine or hand-knetted?"", ""I prefer the knitted ones, my mom use to make cardigans for women"", ""Speaking of cardigans for women, did you know that Coco Chanel is the one credited with popularizing that ?"", ""I didn't know that, I always prefer wool cardigans, but the can now be made with cotton or synthetic fibers too""]","One good thing about synthetic fibers is that they are not made from animals, mostly derived from fibers.","Synthetic fibers (British English: synthetic fibres) are fibers made by humans with chemical synthesis, as opposed to natural fibers that humans get from living organisms with little or no chemical changes.",HALLUCINATION,"{""surface"": ""they"", ""span"": [46, 50]}","{""mentions"": [{""surface"": ""synthetic fibers"", ""span"": [4, 91, 107]}]}"
fdt__354___4,fdt__354___4--0,"[""I love a good hot dog! I especially love one that is loaded with chili and cheese. Do you enjoy hot dogs?"", ""I do not, but do you enjoy any of the other garnishes like mustard or onions or sauerkraut?"", ""I am not a big fan of sauerkraut but I'm totally with you on the mustard! I would like to thank the individual who came up with idea! lol"", ""Have you tried the different ones around the world? Different areas use their local meat, condiments and prepares it their way."", ""No, but I would love to try them on my grill, its my favorite way of eating them."", ""Cool, so you've probably have had your patties pan fried, barbecued, and flame broiled right?"", ""Oh you're making me hungry, I have done all three of those yes. I really love a grilled burger too, do you call it a burger? I know some people reference it with different things."", ""Oh you mean hamburger or beefburger? They're the same but anyway do you have your burgers with sliced bread or buns?"", ""Definitely buns is the way to go my man, nothing else compares. I had a friend bring some hot cross buns before but I want them to go on sale before buying them myself.""]","Ever tried Hot Cross buns? They're mostly popular in UK, Australia, New Zealand, especially during holidays.","Hot cross buns may go on sale in the United Kingdom, Australia and New Zealand as early as New Year's Day or after Christmas.",HALLUCINATION,"{""surface"": ""They"", ""span"": [27, 31]}","{""mentions"": [{""surface"": ""hot cross buns"", ""span"": [8, 90, 104]}]}"
fdt__367___2,fdt__367___2--0,"[""I really haven't read that much Harry Potter but I would like to try to. Have you?"", ""No, due to my status as a bot, I can't read. I do know, however, that the books are about Harry Potter and his friends at Hogwarts."", ""Yes I know that much, but how does he even become one? Is he born that way?"", ""I really don't know. He has a couple of friends that are fellow students, I know that."", ""Ohh cool! So what about his two friends in the book?""]","Ah you mean Hermione and Ron Weasley. Even though Harry is the main character, he wouldn't be great without them I think!","The novels chronicle the life of a young wizard, Harry Potter, and his friends Hermione Granger and Ron Weasley, all of whom are students at Hogwarts School of Witchcraft and Wizardry.",HALLUCINATION,"{""surface"": ""he"", ""span"": [79, 81]}","{""mentions"": [{""surface"": ""Harry Potter"", ""span"": [1, 90, 102]}]}"
fdt__371___1,fdt__371___1--0,"[""My favorite time of year is Halloween and fall so naturally I love the TV show, The Walking Dead"", ""Oh, that's based on a comic book series written by Robert Kirkman, Charlie Adlard, and Tony Moore, were you aware of that?"", ""Awesome, Ive never read the comics but I've heard they are good. One of my favorite characters is Rick Grimes.""]","My favorite character is Carol, but I also love Rick, played by Andrew LIncoln - he awakened from a coma surrounded by zombies!","Andrew Lincoln plays the show's lead character, sheriff's deputy Rick Grimes, who awakens from a coma discovering a world overrun by zombies, commonly referred to as ''walkers''.",HALLUCINATION,"{""surface"": ""he"", ""span"": [81, 83]}","{""mentions"": [{""surface"": ""Rick Grimes"", ""span"": [2, 98, 109]}]}"
