context_id,id,context,claim,evidence_text,response_label,pronoun_info,referent_info
fdt__269___2,fdt__269___2--0,"[""I recently took up archery and I think I love it. Do you know anything about Archery?"", ""Archery is a sport/skill of using a bow to propel arrows."", ""And a great sport it is. Do you know where archery originated from?"", ""I do not know that it was invented at minimum 10000 years ago, and has been used for military and hunting."", ""Wow, thats amazing. Its been around for a long time. Do you know which culture invented it?""]","It came from the ''beginning'' of humanity rpetty much, like Upper Paleolithic to Mesolithic times, there wasn't cultures yet, I believe.","Based on indirect evidence, the bow seems to have been invented near the transition from the Upper Paleolithic to the Mesolithic, some 10,000 years ago.",HALLUCINATION,"{""surface"": ""It"", ""span"": [0, 2]}","{""mentions"": [{""surface"": ""archery"", ""span"": [0, 19, 26]}, {""surface"": ""Archery"", ""span"": [0, 77, 84]}, {""surface"": ""Archery"", ""span"": [1, 0, 7]}, {""surface"": ""archery"", ""span"": [2, 43, 50]}]}"
fdt__273___0,fdt__273___0--0,"[""I love fantasy fiction, but I never finished the Harry Potter series.""]","Yes. They are fantasy novels written by British author J. K. Rowling, if reading is too hard you can watch the movie.",Harry Potter is a series of fantasy novels written by British author J. K. Rowling.,HALLUCINATION,"{""surface"": ""They"", ""span"": [5, 9]}","{""mentions"": [{""surface"": ""Harry Potter series"", ""span"": [0, 49, 68]}]}"
fdt__274___4,fdt__274___4--0,"[""Elvis presley was ahead of his time and really brought in a new era of music"", ""Really? Interesting! He was an actor as well as a singer."", ""He was amazing, didnt he have the title the king of rock or something?"", ""He was called the ''King of Rock and Roll'' or some just call him ''The King'' and he was one of the biggest icons of the 20th century."", ""Such a shame for him to die so young, so many talented people get into drugs early on."", ""Well, on a different note, his first single was Heartbreak Hotel, which hit number 1 in the US."", ""Im not surprised with a name like King."", ""For some personal history, he was born in Tupelo, Mississippi. He and his family moved to Memphis in his 13th year."", ""Oh, interesting. He seemed so cool and humble.""]",He was so generous and often gave away vehicles! His series of tv appearances and top singles made him the leading figure of the sound of rock and roll.,"With a series of successful network television appearances and chart-topping records, he became the leading figure of the newly popular sound of rock and roll.",HALLUCINATION,"{""surface"": ""He"", ""span"": [0, 2]}","{""mentions"": [{""surface"": ""Elvis presley"", ""span"": [0, 0, 13]}, {""surface"": ""King of Rock and Roll"", ""span"": [3, 20, 41]}, {""surface"": ""The King"", ""span"": [3, 68, 76]}]}"
fdt__278___1,fdt__278___1--0,"[""I tried to learn snow skiing.  I just never did very well. So I don't like it"", ""I see, but skiing has around 5000 years of history."", ""That is a long time.  Was it invented in the Nordic countries?""]","Modern skiing is traced back to Scandinavia.  However, there is evidence it was practiced in China many years before that","Although modern skiing has evolved from beginnings in Scandinavia, it may have been practiced more than 100 centuries ago in what is now China, according to an interpretation of ancient paintings.",NON-HALLUCINATION,"{""surface"": ""it"", ""span"": [73, 75]}","{""mentions"": [{""surface"": ""snow skiing"", ""span"": [0, 17, 28]}, {""surface"": ""skiing"", ""span"": [1, 11, 17]}]}"
fdt__278___2,fdt__278___2--0,"[""I tried to learn snow skiing.  I just never did very well. So I don't like it"", ""I see, but skiing has around 5000 years of history."", ""That is a long time.  Was it invented in the Nordic countries?"", ""Modern skiing is traced back to Scandinavia.  However, there is evidence it was practiced in China many years before that"", ""China-that is interesting.  WHy are modern skis so long?""]",They are long and narrow strips that allow for gliding over snow,A ski is a narrow strip of semi-rigid material worn underfoot to glide over snow.,HALLUCINATION,"{""surface"": ""They"", ""span"": [0, 4]}","{""mentions"": [{""surface"": ""modern skis"", ""span"": [4, 36, 47]}]}"
fdt__286___3,fdt__286___3--0,"[""Do you like American football?"", ""I'm a bot, so I can't watch football. I'm aware, however, that it involves two 11-player teams playing on a rectangular field."", ""Oh, OK. I love Washington Redskins."", ""Ah, that team has played over 1,000 games since 1932, and won more than 600 in the regular season."", ""That's a lot of games and running around. I bet there were so many concussions"", ""Oh, really? Concussions and other types of head blows lead to CTE. That has also led to player suicides."", ""what's CTE?""]",It's Chronic traumatic encephalopy and i's found in people who have had multiple head injuries,Chronic traumatic encephalopathy (CTE) is a neurodegenerative disease found in people who have had multiple head injuries.,NON-HALLUCINATION,"{""surface"": ""It"", ""span"": [0, 2]}","{""mentions"": [{""surface"": ""CTE"", ""span"": [5, 62, 65]}, {""surface"": ""CTE"", ""span"": [6, 7, 10]}]}"
fdt__290___0,fdt__290___0--0,"[""Sometimes the taste of popcorn puts me off. Do you like popcorns?""]",I like popcorn. It is based on corn and kernels.,"Popcorn, or pop corn, is a variety of corn kernel, which forcefully expands and puffs up when heated.",HALLUCINATION,"{""surface"": ""It"", ""span"": [16, 18]}","{""mentions"": [{""surface"": ""popcorn"", ""span"": [0, 23, 30]}, {""surface"": ""popcorns"", ""span"": [0, 56, 64]}]}"
fdt__291___2,fdt__291___2--0,"[""Do you like Nickelback? What can you tell me about him so I can be convinced to listen to his songs?"", ""Well, I can tell you that they're Canadian and they formed in 1995."", ""That's good to know, but what have they released?"", ""They released two greatest-hits type albums, Three-Sided Coin in 2002 and in 2013 Volume 1 of The Best of Nickelback."", ""You said their Canadian; that's where I'm from.""]",They are from Alberta in Canada all right.,"Nickelback is a Canadian rock band formed in 1995 in Hanna, Alberta, Canada.",NON-HALLUCINATION,"{""surface"": ""They"", ""span"": [0, 4]}","{""mentions"": [{""surface"": ""Nickelback"", ""span"": [0, 12, 22]}]}"
fdt__292___3,fdt__292___3--0,"[""Archery as in Robin Hood shooting the apple off somebody's head!  So exciting."", ""Speaking of Archery, it was used historically for combat and hunting."", ""Are there different kinds of bows?"", ""There is the composite bow, a traditional bow of horn, wood and sinew."", ""I have heard it takes a lot of strength to draw a bow."", ""I can't confirm if what you heard is correct, what I know is that archery is mainly a recreational activity and competitive sport nowadays"", ""Do people shoot arrows with points, like dangerous points, recreationally?""]",It is mainly a recreational acticity,"In modern times, it is mainly a competitive sport and recreational activity.",NON-HALLUCINATION,"{""surface"": ""It"", ""span"": [0, 2]}","{""mentions"": [{""surface"": ""Archery"", ""span"": [0, 0, 7]}, {""surface"": ""Archery"", ""span"": [1, 12, 19]}, {""surface"": ""archery"", ""span"": [5, 66, 73]}]}"
fdt__295___2,fdt__295___2--0,"[""Hey. My heart hurts from a broken relationship..."", ""That's too bad. A broken heart is a metaphor, but it can refer to physical pain or stress."", ""That's interesting. What else do you know about broken hearts?"", ""It's a concept that's thought to be universal. Many cultures use the same words to describe it."", ""Ah, OK. Is there anything physically happening when we feel a broken heart?""]",It is often said that the affects of heartache produces stress and other emotions.,"The neurological process involved in the perception of heartache is not known, but is thought to involve the anterior cingulate cortex of the brain, which during stress may overstimulate the vagus nerve causing pain, nausea or muscle tightness in the chest.",HALLUCINATION,"{""surface"": ""It"", ""span"": [0, 2]}","{""mentions"": [{""surface"": ""A broken heart"", ""span"": [1, 16, 30]}, {""surface"": ""broken hearts"", ""span"": [2, 48, 61]}, {""surface"": ""a broken heart"", ""span"": [4, 60, 74]}]}"
fdt__297___1,fdt__297___1--0,"[""Green was my favorite color as a kid, very common throughout the world"", ""OK, cool. That's the color between yellow and blue on the visible light spectrum."", ""Its very vibrant and has many different shades""]",It's used a lot in paintings and is one of the additive primary colors,"In subtractive color systems, used in painting and color printing, it is created by a combination of yellow and blue, or yellow and cyan; in the RGB color model, used on television and computer screens, it is one of the additive primary colors, along with red and blue, which are mixed in different combinations to create all other colors.",HALLUCINATION,"{""surface"": ""It"", ""span"": [0, 2]}","{""mentions"": [{""surface"": ""Green"", ""span"": [0, 0, 5]}]}"
fdt__300___1,fdt__300___1--0,"[""Genghis Khan was on of the greatest leaders of all time."", ""He was the Great Khan and the founder of the Mongol Empire, the largest empire in history."", ""I actually know a lot about him. I have a masters in History. Did you know he was born in Delüün Boldog in 1162""]",Yes I did know that and he came to power by uniting the nomadic tribes of Northeast Asia.,He came to power by uniting many of the nomadic tribes of Northeast Asia.,HALLUCINATION,"{""surface"": ""he"", ""span"": [24, 26]}","{""mentions"": [{""surface"": ""Genghis Khan"", ""span"": [0, 0, 12]}]}"
fdt__308___1,fdt__308___1--0,"[""I was surprised to find I loved The Walking Dead. Not my style, usually. Do you watch?"", ""No I don't actually but did you know its available on stuff like the Xbox One, PlayStation 4 and Kindle Fire?"", ""No but I think we're talking about two different things. Anyway, I've been thinking about playing Plants vs. Zombies, have you any info about it?""]",I enjoy strategy games the most.  One of my favorites is Plants Vs. Zombies.  Have you played that one?  It's about homeowners that use plants to try and stop zombies from invading.,The game involves homeowners who use a variety of different plants to prevent an army of zombies from entering their houses and ''eating their brains''.,HALLUCINATION,"{""surface"": ""It"", ""span"": [105, 107]}","{""mentions"": [{""surface"": ""Plants vs. Zombies"", ""span"": [2, 98, 116]}]}"
fdt__317___1,fdt__317___1--0,"[""Where can someone learn about the stock market?"", ""I don't know where you can learn in depth, but I can tell you that the stock market is an aggregate of buyers and sellers of stocks, which are representations of ownership in businesses."", ""Interesting. So technically, when people purchase stocks, they are purchasing a small claim or share on a business?""]",they can also include securities listed on a public stock exchange as well as those only traded privately,"A stock market, equity market or share market is the aggregation of buyers and sellers (a loose network of economic transactions, not a physical facility or discrete entity) of stocks (also called shares), which represent ownership claims on businesses; these may include ''securities'' listed on a public stock exchange as well as those only traded privately.",NON-HALLUCINATION,"{""surface"": ""they"", ""span"": [0, 4]}","{""mentions"": [{""surface"": ""stocks"", ""span"": [1, 125, 131]}, {""surface"": ""stocks"", ""span"": [2, 50, 56]}]}"
fdt__320___2,fdt__320___2--0,"[""I really like Harry Potter books, I have read them all."", ""That's nice. Did you know they were written by J. K. Rowling?"", ""Yes, she is such a great writer. The books are awesome."", ""They've won several awards, and they've also sold over 400 million copies."", ""Yeah, they're insanely popular. What do you know about Rowling as a person?""]","She is the shining star of Yate, Gloucestershire, England i'm sure.","Born in Yate, Gloucestershire, England, Rowling was working as a researcher and bilingual secretary for Amnesty International when she conceived the idea for the ''Harry Potter'' series while on a delayed train from Manchester to London in 1990.",HALLUCINATION,"{""surface"": ""She"", ""span"": [0, 3]}","{""mentions"": [{""surface"": ""J. K. Rowling"", ""span"": [1, 47, 60]}, {""surface"": ""Rowling"", ""span"": [4, 55, 62]}]}"
fdt__321___2,fdt__321___2--0,"[""Have you heard of the band Guns N' Roses? They are my favorite band ever"", ""Sure the band was formed inn 1985 in Los Angeles, California. What is your favorite album?"", ""Id say my favorite is Appetite for destruction"", ""Ah, OK. They've put out six studio albums and sold over 100 million records around the world."", ""They are very popular, The band was formed by Rose’s band, Hollywood Rose, and Tracii Guns’s band, L.A. Guns, thats where they got their name from.""]",That's right.  They are one of the best selling artists of all time.,"Guns N' Roses has released six studio albums, accumulating sales of more than 100 million records worldwide, including 45 million in the United States, making them the 41st best-selling artist of all time.",HALLUCINATION,"{""surface"": ""They"", ""span"": [15, 19]}","{""mentions"": [{""surface"": ""Guns N' Roses"", ""span"": [0, 27, 40]}]}"
fdt__322___0,fdt__322___0--0,"[""Hi, My favorite artist is Guns N' Roses, do you have any thoughts on their music?""]",They are a great hard rock band I heard some of their music.,"Guns N' Roses, often abbreviated as GNR, is an American hard rock band from Los Angeles, California, formed in 1985.",HALLUCINATION,"{""surface"": ""They"", ""span"": [0, 4]}","{""mentions"": [{""surface"": ""Guns N' Roses"", ""span"": [0, 26, 39]}]}"
fdt__325___4,fdt__325___4--0,"[""I'm a paramedic"", ""Oh, neat! So you work in emergency medical situations, like an ambulance, right?"", ""That's right. I work mostly out of an ambulance."", ""Ah, OK. Did you know that in some countries a paramedic is accountable to some sort of professional regulatory body?"", ""Yes, that's true. Do you know when paramedics came about?"", ""It developed in the US during the 1970s as a paraprofession. I'm not sure when it became a full one.."", ""Ah, I see. I'm guessing the roles of the jobs vary between countries."", ""Yup, for example in the UK the paramedic role has developed into an autonomous health professional."", ""Oh really? So they're not under the NHS?""]","no, they have individual licence or practice","Since this time, in countries such as the United Kingdom, the paramedic role has developed into an autonomous health profession, with individual licence to practice, whilst in other countries (including the United States) the paramedic remains an agent working on behalf of a doctor.",HALLUCINATION,"{""surface"": ""they"", ""span"": [4, 8]}","{""mentions"": [{""surface"": ""paramedics"", ""span"": [4, 35, 45]}]}"
fdt__326___3,fdt__326___3--0,"[""Archery is a really fun sport."", ""Oh, is that so? I know of it as using a bow to shoot an arrow."", ""Interesting.  When was archery first used?"", ""I have no idea, but it historically has been used for combat and for hunting."", ""I really enjoy the long bow.  Do you know when it was created?"", ""I don't, but I know the bow and arrow in general were invented either in the late Paleolithic period or the early Mesolithic."", ""Wow, and it's still relevant today.  When was the first compound bow created?""]","I'm not sure the exact time, but it didn't start seeing common use until more modern manufacturing took off in America.","The pulley/cam system grants the user a mechanical advantage, and so the limbs of a compound bow are much stiffer than those of a recurve bow or longbow.",HALLUCINATION,"{""surface"": ""it"", ""span"": [33, 35]}","{""mentions"": [{""surface"": ""compound bow"", ""span"": [6, 56, 68]}]}"
fdt__327___2,fdt__327___2--0,"[""Hi, I love Elvis Presley. How about you?"", ""Not one here but what year did you become his fan? He begun his music career during 1954."", ""I can't really remember, I've just been a fan of his music for a long time. It's a shame he passed so early, do you know what year that was?"", ""Well he died in August of 1977, he was just 42 since he was born in January 1935."", ""That's short lived, how many albums did he release during that time?""]",Quite a few.  He was one of the biggest icons of the 20th century.,"Regarded as one of the most significant cultural icons of the 20th century, he is often referred to as the ''King of Rock and Roll'' or simply ''the King''.",HALLUCINATION,"{""surface"": ""He"", ""span"": [14, 16]}","{""mentions"": [{""surface"": ""Elvis Presley"", ""span"": [0, 11, 24]}]}"
fdt__327___4,fdt__327___4--0,"[""Hi, I love Elvis Presley. How about you?"", ""Not one here but what year did you become his fan? He begun his music career during 1954."", ""I can't really remember, I've just been a fan of his music for a long time. It's a shame he passed so early, do you know what year that was?"", ""Well he died in August of 1977, he was just 42 since he was born in January 1935."", ""That's short lived, how many albums did he release during that time?"", ""I don't know be he is regarded as one of the 1900's most important cultural icons."", ""How did he die?"", ""I don't know that detail but his first RCA single became the top hit in the US."", ""If that is his first single, what would be his last single?""]",I really do not know of the top of my head.  I do know that he helped bring rockabilly to the masses,"The term ''rockabilly'' itself is a portmanteau of ''rock'' (from ''rock 'n' roll'') and ''hillbilly'', the latter a reference to the country music (often called ''hillbilly music'' in the 1940s and 1950s) that contributed strongly to the style.",HALLUCINATION,"{""surface"": ""he"", ""span"": [60, 62]}","{""mentions"": [{""surface"": ""Elvis Presley"", ""span"": [0, 11, 24]}]}"
fdt__337___0,fdt__337___0--0,"[""hello dear who is Elvis Presley?""]","He was an American singer, musician, and actor.","Elvis Aaron Presley (January 8, 1935 – August 16, 1977) was an American singer, musician, and actor.",NON-HALLUCINATION,"{""surface"": ""He"", ""span"": [0, 2]}","{""mentions"": [{""surface"": ""Elvis Presley"", ""span"": [0, 18, 31]}]}"
fdt__337___2,fdt__337___2--0,"[""hello dear who is Elvis Presley?"", ""He was an American singer, musician, and actor."", ""wow he is a whole lot"", ""Well, he indeed was seen as one of the cultural icons of most significance of the 20th century"", ""Where was he from?""]",he was called the King of Rock and Roll,"Regarded as one of the most significant cultural icons of the 20th century, he is often referred to as the ''King of Rock and Roll'' or simply ''the King''.",NON-HALLUCINATION,"{""surface"": ""he"", ""span"": [0, 2]}","{""mentions"": [{""surface"": ""Elvis Presley"", ""span"": [0, 18, 31]}]}"
fdt__337___3,fdt__337___3--0,"[""hello dear who is Elvis Presley?"", ""He was an American singer, musician, and actor."", ""wow he is a whole lot"", ""Well, he indeed was seen as one of the cultural icons of most significance of the 20th century"", ""Where was he from?"", ""I don't have this information right now. Do you want to know anything else about the man referred as the King ?"", ""I want to know about the music he played.""]","There are alot of them on youtube buddy, he had  a series of successful network television appearances and chart-topping records","With a series of successful network television appearances and chart-topping records, he became the leading figure of the newly popular sound of rock and roll.",HALLUCINATION,"{""surface"": ""he"", ""span"": [41, 43]}","{""mentions"": [{""surface"": ""Elvis Presley"", ""span"": [0, 18, 31]}]}"
fdt__345___3,fdt__345___3--0,"[""I just ordered all the Harry Potter books and look forward to reading them"", ""No, I can't read since I'm a bot.  However, I know that the novels were written by J. K. Rowling."", ""Yes, that's right. They're hugely popular."", ""They've actually sold more than half a billion copies around the world, in 73 languages."", ""That's a ton of book! What are they about?"", ""The story is about Harry Potter and his friends at Hogwarts."", ""The books have been insanely popular since they came out world wide""]","I thought they came out more recently than Juen 26, 1997!","Since the release of the first novel, ''Harry Potter and the Philosopher's Stone'', on 26 June 1997, the books have found immense popularity, critical acclaim, and commercial success worldwide.",HALLUCINATION,"{""surface"": ""they"", ""span"": [10, 14]}","{""mentions"": [{""surface"": ""Harry Potter books"", ""span"": [0, 23, 41]}, {""surface"": ""the novels"", ""span"": [1, 56, 66]}, {""surface"": ""The books"", ""span"": [6, 0, 9]}]}"
fdt__348___1,fdt__348___1--0,"[""I love bowling, In fact I do it every week, How about you?"", ""As a bot, I can't bowl, but I know if you get 12 strikes in a row, you achieve the highest score of 300."", ""Yep, that's true. What do you know about bowling balls, by the way?""]",I only have used the bowling balls provided at the bowling alley. Most of the time I use the 12lb ball. Most of the time I hold the ball in the palm of my hand when I throw it.,"Other bowling balls, such as those used in five-pin bowling, candlepin bowling, and duckpin bowling are smaller, lighter, and without holes, so that they may be held in the palm of the bowler's hand.",HALLUCINATION,"{""surface"": ""it"", ""span"": [173, 175]}","{""mentions"": [{""surface"": ""bowling balls"", ""span"": [2, 41, 54]}]}"
fdt__349___1,fdt__349___1--0,"[""I really enjoyed wearing Cardigan sweaters in the fall or winter.  I think it adds a bit of sophistication to a person's wardrobe."", ""Nice that you enjoyed that, do you prefer the ones that are machine or hand-knetted?"", ""I prefer the knitted ones, my mom use to make cardigans for women""]",Cool I didn't know that! They were actually popularized by Coco Chanel who disliked for tight-necked mens sweaters messed up her hair when removed.,Coco Chanel is credited with popularizing cardigans for women because ''she hated how tight-necked men’s sweaters messed up her hair when she pulled them over her head.'',HALLUCINATION,"{""surface"": ""They"", ""span"": [25, 29]}","{""mentions"": [{""surface"": ""Cardigan sweaters"", ""span"": [0, 25, 42]}, {""surface"": ""cardigans"", ""span"": [2, 46, 55]}]}"
fdt__354___0,fdt__354___0--0,"[""I love a good hot dog! I especially love one that is loaded with chili and cheese. Do you enjoy hot dogs?""]","I do, and I love it with mustard, and sauerkraut!","Typical garnishes include mustard, ketchup, onions, mayonnaise, relish, coleslaw, cheese, chili, olives, and sauerkraut.",HALLUCINATION,"{""surface"": ""it"", ""span"": [17, 19]}","{""mentions"": [{""surface"": ""hot dog"", ""span"": [0, 14, 21]}, {""surface"": ""hot dogs"", ""span"": [0, 96, 104]}]}"
fdt__360___3,fdt__360___3--0,"[""I love reading John Grisham books. He has some really good stories"", ""Since you love his books, do you know anything about him at all? I know that he was born February 8, 1955 and his full name is actually John Ray Grisham Jr"", ""I don't know anything about his personal life, but I would like to know where he is from"", ""I don't know where he is from, what I know is that you can read his books in many places around the world since they were translated into 42 languages and also published worldwide."", ""What is his best selling book?"", ""That is also something I don't have. Now moving to information that I do know about, did you know that Grisham graduated from the State University of Mississippi?"", ""Really? I thought he had gone to Law school""]","Agree, most movies are a poor rendition of the book. He also attended the University of Mississippi School of Law in 1981.",John Grisham graduated from Mississippi State University before attending the University of Mississippi School of Law in 1981.,HALLUCINATION,"{""surface"": ""He"", ""span"": [53, 55]}","{""mentions"": [{""surface"": ""John Grisham"", ""span"": [0, 15, 27]}, {""surface"": ""John Ray Grisham Jr"", ""span"": [1, 136, 155]}, {""surface"": ""Grisham"", ""span"": [5, 103, 110]}]}"
fdt__373___3,fdt__373___3--0,"[""hello, when you get down to it , my favorite color is green"", ""many creatures have adapted to their green environments by making themselves green"", ""i can see why, the color green is so prevalent in nature"", ""Minerals are green often as well too, like the emerald"", ""Green emeralds are pretty. They remind me of the hard green candy"", ""Since you find emeralds pretty, you might like to know that they are a cyclosilicate"", ""I like emeralds because they remind me of Pokémon emerald""]","it added new feature like double battles, 135 new pokemon and abilities","New features, such as double battles and Pokémon abilities along with 135 new Pokémon, have been added.",NON-HALLUCINATION,"{""surface"": ""it"", ""span"": [0, 2]}","{""mentions"": [{""surface"": ""Pokémon emerald"", ""span"": [6, 42, 57]}]}"
