context_id,id,context,claim,evidence_text,response_label,pronoun_info,referent_info
fdt__327___1,fdt__327___1--0,"[""Hi, I love Elvis Presley. How about you?"", ""Not one here but what year did you become his fan? He begun his music career during 1954."", ""I can't really remember, I've just been a fan of his music for a long time. It's a shame he passed so early, do you know what year that was?""]","Well he died in 1977, at the age of 42.  That ended is career as a singer and actor","Elvis Aaron Presley (January 8, 1935 – August 16, 1977) was an American singer, musician, and actor.",HALLUCINATION,"{""surface"": ""he"", ""span"": [5, 7]}","{""mentions"": [{""surface"": ""Elvis Presley"", ""span"": [0, 11, 24]}]}"
fdt__329___0,fdt__329___0--0,"[""I lvoe bowling! Do you?""]","Yes, it's so fun. I love rolling and knocking down the pins and targets",Bowling is a sport or leisure activity in which a player rolls or throws a bowling ball towards a target.,HALLUCINATION,"{""surface"": ""it"", ""span"": [5, 7]}","{""mentions"": [{""surface"": ""bowling"", ""span"": [0, 7, 14]}]}"
fdt__332___1,fdt__332___1--0,"[""I am on instagram and love to see all the cool pics everyone posts"", ""What about your pics, do you like to post them on this photo-sharing application and service called Instagram ?"", ""I don't post very often, what I like about Instagram is that makes it easy to keep up with what family and friends are doing""]","yes, i agree with you! I can't believe it was created in 2010 and excusevily for IOS operating system","It was created by Kevin Systrom and Mike Krieger, and launched in October 2010 as a free mobile app exclusively for the iOS operating system.",HALLUCINATION,"{""surface"": ""it"", ""span"": [39, 41]}","{""mentions"": [{""surface"": ""instagram"", ""span"": [0, 8, 17]}, {""surface"": ""Instagram"", ""span"": [1, 100, 109]}, {""surface"": ""Instagram"", ""span"": [2, 43, 52]}]}"
fdt__332___2,fdt__332___2--0,"[""I am on instagram and love to see all the cool pics everyone posts"", ""What about your pics, do you like to post them on this photo-sharing application and service called Instagram ?"", ""I don't post very often, what I like about Instagram is that makes it easy to keep up with what family and friends are doing"", ""So, for how lond do you and your family and friends have an Instagram account? I know that Instagram was launched on October 2010"", ""I believe we all created an account on Instagram at the same time we created one on Facebook""]",me too. Now it's owned by Facebook,It is owned by Facebook.,HALLUCINATION,"{""surface"": ""it"", ""span"": [12, 14]}","{""mentions"": [{""surface"": ""instagram"", ""span"": [0, 8, 17]}, {""surface"": ""Instagram"", ""span"": [1, 100, 109]}, {""surface"": ""Instagram"", ""span"": [2, 43, 52]}, {""surface"": ""Instagram"", ""span"": [3, 60, 69]}, {""surface"": ""Instagram"", ""span"": [3, 91, 100]}, {""surface"": ""Instagram"", ""span"": [4, 39, 48]}]}"
fdt__333___0,fdt__333___0--0,"[""I always wanted to learn how to do archery. What can you tell me about it?""]",It is a cool sport actually!  You use the skill of using a bow to shoot arrows at targets (or people - - whichever),"Archery is the sport, practice or skill of using a bow to propel arrows.",HALLUCINATION,"{""surface"": ""It"", ""span"": [0, 2]}","{""mentions"": [{""surface"": ""archery"", ""span"": [0, 35, 42]}]}"
fdt__335___4,fdt__335___4--0,"[""I love chihuahuas, I have 2 of them."", ""So, do you like small dogs? chihuahua is the smalles breed of dog"", ""Yep, they get a bad rap about their demeanor too. Most people say they're mean but one of mine is the sweetest ever."", ""Cool, did you know that the breed is originally from mexico, as archaeological finds show?"", ""I've always wondered if they came from the city Chihuahua, Mexico. My sister in law visited there once."", ""Well, the breed was actually name after Chihuahua, the state in mexico"", ""Ah so that makes sense why mine think they're gods lol"", ""Are you talking about gods in the aztec religion, the religion of the aztecs ?"", ""Yes, I was reading about this mesoamerican religion""]",Absolutely they even mad wheeled dog toys representing the  Chihuahua kids could carry around with for good luck and fun.,"In fact, wheeled dog toys representing the Chihuahua have been unearthed across Mesoamerica from Mexico to El Salvador.",HALLUCINATION,"{""surface"": ""they"", ""span"": [11, 15]}","{""mentions"": [{""surface"": ""the aztecs"", ""span"": [7, 66, 76]}]}"
fdt__336___3,fdt__336___3--0,"[""Have you ever been waterfowl hunting?"", ""No, I've never been, as I'm a bot. Have you ever been waterfowl hunting? It's also called wildfowling in the UK."", ""Sort of yes, it is duckhunting and you sometimes have a dog with you to retrieve them"", ""Oh, I see. Do you have a shotgun? They can be used with shot or with slugs."", ""Yes, usually you'd use shot for this type of hunting."", ""It seems in some countries hunting waterfowl for commercial purposes is banned."", ""That is how it is here as well, I think that makes good sense though""]",So I guess people started hunting them for food. I cannot imagine that they would taste too good.,"Wild waterfowl have been hunted for food, down, and feathers worldwide since prehistoric times.",HALLUCINATION,"{""surface"": ""they"", ""span"": [71, 75]}","{""mentions"": [{""surface"": ""waterfowl"", ""span"": [5, 35, 44]}]}"
fdt__338___0,fdt__338___0--0,"[""i think skiing is for rich people""]","Same here, I've never tried skiing whether it was for recreation or for transport.","Skiing can be a means of transport, a recreational activity or a competitive winter sport in which the participant uses skis to glide on snow.",HALLUCINATION,"{""surface"": ""it"", ""span"": [43, 45]}","{""mentions"": [{""surface"": ""skiing"", ""span"": [0, 8, 14]}]}"
fdt__338___2,fdt__338___2--0,"[""i think skiing is for rich people"", ""Really? It can be used as a form of transport."", ""yeah the equipment is too expensive, even if you rent"", ""Do you watch competitive skiing, like those events the International Olympic Committee recognizes?"", ""That's cool. Do you have any favorite skiers?""]","Not really, but it has been around for so long, or about five millennia.",Skiing has a history of almost five millennia.,HALLUCINATION,"{""surface"": ""it"", ""span"": [16, 18]}","{""mentions"": [{""surface"": ""skiing"", ""span"": [0, 8, 14]}]}"
fdt__342___1,fdt__342___1--0,"[""I love chocolate bars.  Have you ever heard of Dylan's Candy Bar?"", ""I know that the daughter of Ralph Lauren, Dylan Lauren owns it."", ""Who is Dylan Lauren?""]",She is an american entrepreneur!,"Dylan Lauren (born May 9, 1974) is an American entrepreneur.",NON-HALLUCINATION,"{""surface"": ""She"", ""span"": [0, 3]}","{""mentions"": [{""surface"": ""Dylan Lauren"", ""span"": [1, 42, 54]}, {""surface"": ""Dylan Lauren"", ""span"": [2, 7, 19]}]}"
fdt__342___2,fdt__342___2--0,"[""I love chocolate bars.  Have you ever heard of Dylan's Candy Bar?"", ""I know that the daughter of Ralph Lauren, Dylan Lauren owns it."", ""Who is Dylan Lauren?"", ""She is an american entrepreneur!"", ""I see.  She is a fashion designer?  What kind of clothes does she make?""]","She does not focus too much on clothes, her goal is to merge fashion and candy with art","Lauren said that her goal was to ''merge fashion, art and pop candy culture''.",HALLUCINATION,"{""surface"": ""She"", ""span"": [0, 3]}","{""mentions"": [{""surface"": ""Dylan Lauren"", ""span"": [1, 42, 54]}, {""surface"": ""Dylan Lauren"", ""span"": [2, 7, 19]}]}"
fdt__345___0,fdt__345___0--0,"[""I just ordered all the Harry Potter books and look forward to reading them""]","I have never read any books by the British author J.K. Rowling, it does sound like an interesting series though",Harry Potter is a series of fantasy novels written by British author J. K. Rowling.,HALLUCINATION,"{""surface"": ""it"", ""span"": [64, 66]}","{""mentions"": [{""surface"": ""Harry Potter"", ""span"": [0, 23, 35]}]}"
fdt__346___0,fdt__346___0--0,"[""I love American football dont you?""]",I do too! It's a great team sport played on a rectangular field between two goalposts.,"American football, referred to as football in the United States and Canada, and also known as gridiron football or simply gridiron, is a team sport played by two teams of eleven players on a rectangular field with goalposts at each end.",HALLUCINATION,"{""surface"": ""It"", ""span"": [10, 12]}","{""mentions"": [{""surface"": ""American football"", ""span"": [0, 7, 24]}]}"
fdt__359___2,fdt__359___2--0,"[""my favorite color is green"", ""That is the color between blue and yellow."", ""if I recall it is a secondary color since it is made up of two primary colors"", ""That's interesting. A lot of creatures have become green to adapt to their surroundings."", ""i wonder if green is the most common color in nature""]",I am not sure but I know it is common in plants.,"Green is common in nature, especially in plants.",NON-HALLUCINATION,"{""surface"": ""it"", ""span"": [25, 27]}","{""mentions"": [{""surface"": ""green"", ""span"": [0, 21, 26]}, {""surface"": ""green"", ""span"": [3, 51, 56]}, {""surface"": ""green"", ""span"": [4, 12, 17]}]}"
fdt__360___1,fdt__360___1--0,"[""I love reading John Grisham books. He has some really good stories"", ""Since you love his books, do you know anything about him at all? I know that he was born February 8, 1955 and his full name is actually John Ray Grisham Jr"", ""I don't know anything about his personal life, but I would like to know where he is from""]","He lives outside Oxford, Mississippi. His books have been translated into 42 languages.",His books have been translated into 42 languages and published worldwide.,HALLUCINATION,"{""surface"": ""He"", ""span"": [0, 2]}","{""mentions"": [{""surface"": ""John Grisham"", ""span"": [0, 15, 27]}, {""surface"": ""John Ray Grisham Jr"", ""span"": [1, 136, 155]}]}"
fdt__367___1,fdt__367___1--0,"[""I really haven't read that much Harry Potter but I would like to try to. Have you?"", ""No, due to my status as a bot, I can't read. I do know, however, that the books are about Harry Potter and his friends at Hogwarts."", ""Yes I know that much, but how does he even become one? Is he born that way?""]","Correct! I think he is born that way, and then later goes to Hogwarts to study Wizadry and better develop his powers.","The novels chronicle the life of a young wizard, Harry Potter, and his friends Hermione Granger and Ron Weasley, all of whom are students at Hogwarts School of Witchcraft and Wizardry.",HALLUCINATION,"{""surface"": ""he"", ""span"": [17, 19]}","{""mentions"": [{""surface"": ""Harry Potter"", ""span"": [1, 90, 102]}]}"
fdt__368___0,fdt__368___0--0,"[""Do you like the color green? It isn't my favorite but it is found everywhere in nature.""]","I like it.  I tend toward blues and purples, but of course, green is very popular at Christmas!",Green is the color between blue and yellow on the visible spectrum.,HALLUCINATION,"{""surface"": ""it"", ""span"": [7, 9]}","{""mentions"": [{""surface"": ""green"", ""span"": [0, 22, 27]}]}"
fdt__368___2,fdt__368___2--0,"[""Do you like the color green? It isn't my favorite but it is found everywhere in nature."", ""I'm a bot, so I have no opinion. Were you aware that it sits between yellow and blue on the spectrum of visible light?"", ""Yes, actually. I wonder how green and red became Christmas colors."", ""I'm not 100% sure on that, but the celebration of Christmas in many countries includes lighting Christmas trees and hanging wreaths."", ""What else do you know about the color green?""]","Well,it's the color of money!  Seriously, though, in the Middle Ages and Renaissance, merchants and bankers were associated with green and nobility was associated with red.","In the Middle Ages and Renaissance, green was the color commonly associated with merchants, bankers and the gentry, while red was reserved for the nobility.",HALLUCINATION,"{""surface"": ""it"", ""span"": [5, 7]}","{""mentions"": [{""surface"": ""green"", ""span"": [0, 22, 27]}, {""surface"": ""green"", ""span"": [2, 28, 33]}, {""surface"": ""green"", ""span"": [4, 38, 43]}]}"
fdt__370___1,fdt__370___1--0,"[""My little brother has a broken heart and I dont know how to help him"", ""That's tough. Broken heart is a metaphor for the intense pain or stress from longing. Is that what happened to him?"", ""He lost his girlfriend to cancer""]",Emotional pain from a broken heart can cause ''broken heart syndrome'' if it gets sever enough. Hes going to need a lot of support.,"Emotional pain that is severe can cause 'broken heart syndrome', including physical damage to the heart.",HALLUCINATION,"{""surface"": ""it"", ""span"": [74, 76]}","{""mentions"":[{""surface"":""the intense pain or stress from longing"",""span"":[1,45,84]}]}"
fdt__371___0,fdt__371___0--0,"[""My favorite time of year is Halloween and fall so naturally I love the TV show, The Walking Dead""]","I love it too!  I have also read the comic book series by Robert Kirkman, Tony Moore and Charlie Adlard","The Walking Dead is an American post-apocalyptic horror television series developed by Frank Darabont for AMC that is based on the comic book series of the same name by Robert Kirkman, Tony Moore, and Charlie Adlard.",HALLUCINATION,"{""surface"": ""it"", ""span"": [7, 9]}","{""mentions"": [{""surface"": ""Walking Dead"", ""span"": [0, 84, 96]}]}"
fdt__372___0,fdt__372___0--0,"[""I dont like bees because they sting""]","me too, they are flying insects closely related to wasps and ants, known for their role in pollination","Bees are flying insects closely related to wasps and ants, known for their role in pollination and, in the case of the best-known bee species, the European honey bee, for producing honey and beeswax.",HALLUCINATION,"{""surface"": ""they"", ""span"": [8, 12]}","{""mentions"": [{""surface"": ""bees"", ""span"": [0, 12, 16]}]}"
fdt__373___2,fdt__373___2--0,"[""hello, when you get down to it , my favorite color is green"", ""many creatures have adapted to their green environments by making themselves green"", ""i can see why, the color green is so prevalent in nature"", ""Minerals are green often as well too, like the emerald"", ""Green emeralds are pretty. They remind me of the hard green candy""]","emerald is a cyclosilicate, it reminds me of my favorite game, pokemon emerald!",Emerald is a cyclosilicate.,HALLUCINATION,"{""surface"": ""it"", ""span"": [28, 30]}","{""mentions"": [{""surface"": ""the emerald"", ""span"": [3, 43, 54]}]}"
fdt__381___2,fdt__381___2--0,"[""nickelback is very hit or miss"", ""Oh, is that so? They did go through a few drummers between 1995 and 2005."", ""oh really? I didnt know that"", ""Yep, Adair replaced Ryan Vikedal in the final change."", ""Huh, I guess it worked for them; they're very successful.""]",Yep but despite that they're still one of the most commercially successful Canadian groups. Hard to believe right?,"Nickelback is one of the most commercially successful Canadian groups, having sold more than 50 million albums worldwide and ranking as the eleventh best-selling music act, and the second best-selling foreign act in the U.S. of the 2000s, behind The Beatles.",HALLUCINATION,"{""surface"": ""they"", ""span"": [21, 25]}","{""mentions"": [{""surface"": ""nickelback"", ""span"": [0, 0, 10]}]}"
fdt__383___0,fdt__383___0--0,"[""Hey there! I really love the color green. You?""]",Yes green is my favorite color! It's between blue and yellow on the visible spectrum.,Green is the color between blue and yellow on the visible spectrum.,HALLUCINATION,"{""surface"": ""It"", ""span"": [32, 34]}","{""mentions"": [{""surface"": ""green"", ""span"": [0, 35, 40]}]}"
fdt__384___3,fdt__384___3--0,"[""I have been a gymnast for 15 year=s."", ""Would you say you are good at balance, flexibility, agility, strength, coordination, control and endurance, then ? The sport of gymnastics requires all of it"", ""Yes It helps me stay in really good shape."", ""Speaking of good shape, are you arms, shoulders, legs, chest, back and abdominal muscle groups developed? The gymnastics movements contribute to it"", ""I would say they are pretty developed indeed"", ""What about precision, self-confidence and self-discipline ? Those are also developed through gymnastics"", ""Yes I think that's something that comes naturally.""]","Gymnastics came from the Greeks, interestingly. It came from circus performance skills.","Gymnastics evolved from exercises used by the ancient Greeks that included skills for mounting and dismounting a horse, and from circus performance skills.",NON-HALLUCINATION,"{""surface"": ""It"", ""span"": [48, 50]}","{""mentions"": [{""surface"": ""gymnastics"", ""span"": [1, 128, 138]}, {""surface"": ""gymnastics"", ""span"": [5, 93, 103]}]}"
fdt__384___4,fdt__384___4--0,"[""I have been a gymnast for 15 year=s."", ""Would you say you are good at balance, flexibility, agility, strength, coordination, control and endurance, then ? The sport of gymnastics requires all of it"", ""Yes It helps me stay in really good shape."", ""Speaking of good shape, are you arms, shoulders, legs, chest, back and abdominal muscle groups developed? The gymnastics movements contribute to it"", ""I would say they are pretty developed indeed"", ""What about precision, self-confidence and self-discipline ? Those are also developed through gymnastics"", ""Yes I think that's something that comes naturally."", ""Gymnastics came from the Greeks, interestingly, it came from circus performance skills."", ""Yes I can definitely see that. The circus contains a ton of gymnastics.""]",Nowadays most competitive  gymnastics are governed by the FIG so it is more formal now.,Most forms of competitive gymnastics events are governed by the Fédération Internationale de Gymnastique (FIG).,HALLUCINATION,"{""surface"": ""it"", ""span"": [65, 67]}","{""mentions"": [{""surface"": ""gymnastics"", ""span"": [1, 128, 138]}, {""surface"": ""gymnastics"", ""span"": [5, 93, 103]}, {""surface"": ""Gymnastics"", ""span"": [7, 0, 10]}, {""surface"": ""gymnastics"", ""span"": [8, 60, 70]}]}"
fdt__389___2,fdt__389___2--0,"[""i wanna start drinking protein shakes"", ""Well, athletes and strong men have been using herbal mixtures and tonics to increase stamina and strength since ancient times."", ""cool, tell me more plz"", ""Eugen Sandow was the first Western modern bodybuilder to advocate control of diet to help grow your muscles."", ""i've never heard of him! Where is Eugen Sandow from?""]","He was born in Kaliningrad, Russia and was the son of a German father and Russian mother.","Sandow was born in Königsberg, Prussia (now Kaliningrad, Russia) on April 2, 1867 to a German father and a Russian mother.",NON-HALLUCINATION,"{""surface"": ""He"", ""span"": [0, 2]}","{""mentions"": [{""surface"": ""Eugen Sandow"", ""span"": [3, 0, 12]}, {""surface"": ""Eugen Sandow"", ""span"": [4, 34, 46]}]}"
fdt__397___0,fdt__397___0--0,"[""I started learning Japanese a couple of years ago""]",There does not seem to be a lot of history on Japanese language or even a date it first appeared.,"Little is known of the language's prehistory, or when it first appeared in Japan.",NON-HALLUCINATION,"{""surface"": ""it"", ""span"": [79, 81]}","{""mentions"": [{""surface"": ""Japanese"", ""span"": [0, 19, 27]}]}"
fdt__398___1,fdt__398___1--0,"[""Do you like guns n roses? I was not around at that time, but i have heard the classics"", ""I can't listen to music since I'm a bot, but I know they're a band from California. They formed in 1985."", ""That makes sense, it was a bit before my time, how many albums have the sold in total?""]","To date, they've release 6 studio albums that sold over 100million albums total.","Guns N' Roses has released six studio albums, accumulating sales of more than 100 million records worldwide, including 45 million in the United States, making them the 41st best-selling artist of all time.",NON-HALLUCINATION,"{""surface"": ""they"", ""span"": [9, 13]}","{""mentions"": [{""surface"": ""guns n roses"", ""span"": [0, 12, 24]}]}"
fdt__399___0,fdt__399___0--0,"[""Everyone has seen Harry Potter except me. Have you ever read the books or watched the movies?""]",Yes I am a big fan of it actually. I love reading about chronicles of the life of a young wizard,"The novels chronicle the life of a young wizard, Harry Potter, and his friends Hermione Granger and Ron Weasley, all of whom are students at Hogwarts School of Witchcraft and Wizardry.",HALLUCINATION,"{""surface"": ""it"", ""span"": [22, 24]}","{""mentions"": [{""surface"": ""Harry Potter"", ""span"": [0, 18, 30]}]}"
fdt__401___0,fdt__401___0--0,"[""Green is such a nice color.""]",It is between blue and yellow on the visible spectrum and comes in many shades.,Green is the color between blue and yellow on the visible spectrum.,HALLUCINATION,"{""surface"": ""It"", ""span"": [0, 2]}","{""mentions"": [{""surface"": ""Green"", ""span"": [0, 0, 5]}]}"
fdt__403___4,fdt__403___4--0,"[""I love to watch the Walking Dead TV show. Can you tell me about it?"", ""Sure, the walking dead is a post-apocalyptic horror TV series, based on the comic books series by Robert Kirkman"", ""Yeah my favorite character is Daryl. I heard he will take over as leader in the next season."", ""What else do you know about the next season? I know that the series is developed by Frank Darabont"", ""I can't wait for Maggie to deliver their baby, I think it will happen next season."", ""Cool, not tell me, what do you think about the shows lead character played by Andrew Lincoln"", ""I like him but apparently he dies next season. He is moving on to other projects."", ""i did not know that. Together they struggle to survive and adapt in a post-apocalyptic world."", ""It is the last season so they will have to wrap things up somehow.""]","yeah it will be neat.  Much of the series takes place in and around Atlanta, Georgia still today i think","Much of the series takes place in and around Atlanta, Georgia, and later Alexandria, Virginia.",HALLUCINATION,"{""surface"": ""it"", ""span"": [5, 7]}","{""mentions"":[{""surface"":""the last season"",""span"":[8,6,21]}]}"
fdt__405___2,fdt__405___2--0,"[""Have you ever taken an archery class? I have and it was lots of fun."", ""The truth is that bots are not able do to that. Something that is also true the subject of archery is that it has been used for combat and hunting historically"", ""Yes, it is quite neat how it has evolved. It can be challenging at first but once you get the hang of it, it becomes a lot of fun."", ""Nice, did you know that this activity you find fun dates as far back as 10,000-9000 BC ?"", ""I did not know that it dated back that far. I knew it was one of the oldest forms of weaponry but had no clue it was that old.""]",Indeed it is. Some of the oldest bows discovered appear to come from Holmegård swamp in Denmark.,The oldest bows known so far come from the Holmegård swamp in Denmark.,HALLUCINATION,"{""surface"": ""it"", ""span"": [7, 9]}","{""mentions"": [{""surface"": ""archery"", ""span"": [0, 23, 30]}, {""surface"": ""archery"", ""span"": [1, 91, 98]}]}"
fdt__407___3,fdt__407___3--0,"[""I was a cheerleader in high school. Were you ever a cheer leader?"", ""No, I'm a bot and can't do such things. I am aware, however that it involves cheering for your team to encourage them."", ""Oh, OK. I was a football cheerleader. It was less intense than it is now."", ""Cheerleading can involve anything from chanting slogans to truly intense physical activity."", ""I loved doing the pyramid."", ""Did you do competitive cheerleading, with one to three minute routines of various activities like tumbling and jumping?"", ""No, we just did it for entertainment. When was cheerleading invented.""]","Was cheerleading a scientific invention? As far as I know it originated in the United States, an","Cheerleading originated in the United States, and remains predominantly in America, with an estimated 1.5 million participants in all-star cheerleading.",HALLUCINATION,"{""surface"": ""it"", ""span"": [58, 60]}","{""mentions"": [{""surface"": ""Cheerleading"", ""span"": [3, 0, 12]}, {""surface"": ""cheerleading"", ""span"": [6, 47, 59]}]}"
fdt__2___1,fdt__2___1--0,"[""My favorite color is green.  I love Money, green lights when i am driving, and the color of plants.  Green is fantastic!!!"", ""Well, that's cool. It is between yellow and blue on the visible spectrum."", ""Yes it is. It is also the color of Emeralds, and sometimes the color of camouflage.""]",I have read it has a dominant wavelength of roughly 495570 nm.,It is evoked by light which has a dominant wavelength of roughly 495570 nm.,HALLUCINATION,"{""surface"": ""it"", ""span"": [12, 14]}","{""mentions"": [{""surface"": ""green"", ""span"": [0, 21, 26]}, {""surface"": ""Green"", ""span"": [0, 101, 106]}]}"
